{
  "$schema": "https://json-schema.org/draft/2020-12/schema",
  "$id": "superdesktop://evidence/coverage/1.0.0",
  "title": "SuperDesktop task coverage manifest",
  "type": "object",
  "required": ["schema_version", "change", "capabilities", "tasks"],
  "properties": {
    "schema_version": {"const": "1.0.0"},
    "change": {"pattern": "^[a-z0-9-]+$"},
    "capabilities": {"type": "array", "minItems": 1, "items": {"pattern": "^[a-z0-9-]+$"}},
    "tasks": {
      "type": "array",
      "items": {
        "type": "object",
        "required": ["task_id", "mandatory", "capability_id", "requirement_id", "scenario_id", "gates"],
        "properties": {
          "task_id": {"pattern": "^[a-z0-9-]+/[0-9]+\\.[0-9]+\\.[0-9]+$"},
          "mandatory": {"type": "boolean"},
          "capability_id": {"pattern": "^[a-z0-9-]+$"},
          "requirement_id": {"pattern": "^[a-z0-9-]+$"},
          "scenario_id": {"pattern": "^[a-z0-9-]+$"},
          "gates": {"type": "array", "minItems": 1, "items": {"pattern": "^G-[A-Z0-9-]+$"}}
        },
        "additionalProperties": false
      }
    }
  },
  "additionalProperties": false
}
